[
  {
    "id": "F-001",
    "severity": "major",
    "file": "apps/cli/src/runtime/outbound.ts",
    "line": 33,
    "problem": "Repeated relay publication creates a different signed bundle for the same reserved one-time prekey.",
    "impact": "After relay publish commits but its response is lost, rerunning the CLI command submits a new bundle ID containing the same OTK. The relay rejects the retry under its permanent OTK uniqueness contract, so the user cannot recover a successful publication result. Even repeating a successful publish fails.",
    "suggested_fix": "Persist the exact signed publication bundle before the first network call and reuse it across attempts and process restarts. Keep allocation of a fresh OTK and a fresh bundle as a separate explicit operation.",
    "evidence": "outbound.ts:33 calls profile.exportContact on every attempt; profile.ts:89 calls exportSignedSignalBundleV2; wire.ts:51 assigns randomUUID; SignalClient.ts:228 reads the unchanged pre:1. Specification Relay v2 Publish permits idempotence only for identical stored bundle bytes and forbids OTK reuse under a new ID. This is a source-derived reproduction; no relay mutation was performed.",
    "class_scope": {
      "sites": [
        "apps/cli/src/runtime/outbound.ts:33",
        "apps/cli/src/runtime/profile.ts:89",
        "packages/session-node/src/wire.ts:51",
        "packages/session-node/src/SignalClient.ts:228"
      ],
      "enumeration_method": "Enumerated the single runtime publish producer and its export/publicBundle call chain; keryx ctx rg for publish, bundle_id: randomUUID, and preBytes verifies the producer and reuse sites."
    },
    "confidence": "high",
    "reviewer": "review-logic",
    "dedupe_key": "F-001-logic",
    "blocking_merge": false,
    "global_id": "2026-09-06-path-echolet-cli-prototype-t28#F-001"
  },
  {
    "id": "F-002",
    "severity": "major",
    "file": "apps/cli/src/commands/cli.ts",
    "line": 144,
    "problem": "Interactive contact confirmation waits for stdin EOF instead of accepting a completed input line.",
    "impact": "A user entering yes followed by Enter at the displayed [y/N] prompt remains blocked; contact import does not finish until the user supplies EOF. A negative line also waits for EOF.",
    "suggested_fix": "Read one bounded line using a readline interface or stop at the first newline, close the reader, and settle on EOF or an overlong answer without requiring stdin to close after a valid line.",
    "evidence": "cli.ts:144-148 iterates until stdin ends, with only an overlength early return. A read-only probe extracted the exact function and supplied a PassThrough: settledAfterCompleteLine=false after a yes newline, acceptedAfterEOF=true only after input.end(). cli.test.ts:29 always ends stdin, masking terminal behavior.",
    "class_scope": {
      "sites": [
        "apps/cli/src/commands/cli.ts:144"
      ],
      "enumeration_method": "keryx ctx rg readConfirmation found its single definition and sole contact-import caller at cli.ts:199; no other interactive reader exists in the CLI command implementation."
    },
    "confidence": "high",
    "reviewer": "review-logic",
    "dedupe_key": "F-002-logic",
    "blocking_merge": false,
    "global_id": "2026-09-06-path-echolet-cli-prototype-t28#F-002"
  },
  {
    "id": "F-003",
    "severity": "major",
    "file": "apps/cli/src/runtime/outbound.ts",
    "line": 28,
    "problem": "Runtime database failures are converted into trust/protocol errors and exit code 3.",
    "impact": "For example, let send finish its HTTP request while another SQLite connection holds BEGIN IMMEDIATE; the post-send delivery-state transaction fails with SQLITE_BUSY. Outbound serial rewrites it to OUTBOUND_REJECTED and classify returns 3, although the documented result for local persistence failure is 5. Inbound history/poll and contact-import commits similarly hide database failures as protocol or invalid-card errors.",
    "suggested_fix": "Introduce a typed persistence failure at the store boundary and preserve it through runtime and contact-import catch blocks; map it to redacted PERSISTENCE_FAILURE/exit 5. Keep typed validation, trust and native decrypt failures mapped to exit 3.",
    "evidence": "EncryptedSqliteStore.ts:25 uses busy_timeout=0 and :61 begins each transaction with BEGIN IMMEDIATE. Outbound.ts:26-28 and inbound.ts:23-25 replace all non-domain/non-relay errors; cli.ts:201 catches all import errors as INVALID_CONTACT_CARD, and :252-253 maps domain errors to trustFailure. Wrong-key open failures are handled correctly, but failures after opening are not. Reproduction is source-derived, not executed.",
    "class_scope": {
      "sites": [
        "apps/cli/src/runtime/outbound.ts:28",
        "apps/cli/src/runtime/inbound.ts:25",
        "apps/cli/src/commands/cli.ts:201",
        "apps/cli/src/commands/cli.ts:252"
      ],
      "enumeration_method": "Enumerated catch blocks with keryx ctx rg catch|OUTBOUND_REJECTED|INBOUND_REJECTED|PERSISTENCE_FAILURE across command and runtime files, then followed every store-transaction caller into the single CLI classify function; these runtime/import catch boundaries erase persistence errors while profile-open boundaries preserve exit 5."
    },
    "confidence": "high",
    "reviewer": "review-logic",
    "dedupe_key": "F-003-logic",
    "blocking_merge": false,
    "global_id": "2026-09-06-path-echolet-cli-prototype-t28#F-003"
  },
  {
    "id": "F-004",
    "severity": "blocker",
    "file": "apps/relay/internal/storage/repository/mailbox_repo.go",
    "line": 30,
    "problem": "Saving an existing envelope ID silently replaces the accepted mailbox record.",
    "impact": "Submit envelope A, then a different otherwise accepted envelope B with the same recipient mailbox and envelope ID before the receiver polls. Both sends succeed, but B overwrites A; the original accepted message is irretrievably lost. Sequential requests suffice.",
    "suggested_fix": "Read the existing record inside the same transaction. Return success only for an identical envelope; reject changed content with a conflict error and map it to HTTP 409. Retry transaction conflicts safely.",
    "evidence": "mailbox_repo.go:28-31 constructs mailbox:<recipient>:<envelope-id> and calls SetEntry without reading old content. mailbox_handler.go:66-79 returns success for both writes. ValidateMailboxEnvelope does not enforce envelope identity uniqueness. Unlike SaveSignalV2, no mailbox equality/conflict check exists. Source-derived reproduction; no live writes performed.",
    "class_scope": {
      "sites": [
        "apps/relay/internal/storage/repository/mailbox_repo.go:30",
        "apps/relay/internal/api/handler/mailbox_handler.go:66"
      ],
      "enumeration_method": "keryx ctx rg ENVELOPE_ID_CONFLICT|WithTTL|ExpiresAtMs|DeleteEnvelope across apps/relay/internal plus full MailboxService read enumerates the single mailbox writer and its single send-handler path; no existing conflict branch."
    },
    "blocking_merge": true,
    "reviewer": "review-backend",
    "confidence": "high",
    "dedupe_key": "backend-F-001",
    "global_id": "2026-09-06-path-echolet-cli-prototype-t28#F-004"
  },
  {
    "id": "F-005",
    "severity": "major",
    "file": "apps/relay/internal/storage/repository/mailbox_repo.go",
    "line": 30,
    "problem": "Mailbox retention and selection ignore the envelope expiry time.",
    "impact": "A normal CLI send expires after 24 hours, but SaveEnvelope retains it for 7 days. If the recipient returns after 24 hours, GetEnvelopes still returns the expired envelope; inbound rejects the entire batch before ack. Repeated polls remain blocked by that expired record, including new valid messages selected in the same batch, until physical TTL expiry.",
    "suggested_fix": "Reject already-expired envelopes, retain each envelope no longer than its remaining declared lifetime (and configured server cap), and filter expiry during retrieval before applying the batch limit. Do not extend expiry on identical retries.",
    "evidence": "outbound.ts:79 sets expires_at_ms to created+86400000; mailbox_repo.go:30 assigns fixed WithTTL(7*24*time.Hour), and :47-55 appends stored records without checking ExpiresAtMs. cleanup_service.go:43-45 relies solely on Badger TTL. inbound.ts:46 rejects expires_at_ms<=now before any pending ack is recorded. This is a normal delayed-receiver scenario, not a malicious-input claim.",
    "class_scope": {
      "sites": [
        "apps/relay/internal/storage/repository/mailbox_repo.go:30",
        "apps/relay/internal/storage/repository/mailbox_repo.go:53",
        "apps/relay/internal/service/cleanup_service.go:43",
        "apps/relay/internal/validation/validate.go:85"
      ],
      "enumeration_method": "keryx ctx rg WithTTL|ExpiresAtMs|DeleteEnvelope across relay internal code enumerates the only mailbox writer, reader, cleanup and lifetime validation boundaries; none uses current time to enforce envelope lifetime."
    },
    "blocking_merge": false,
    "reviewer": "review-backend",
    "confidence": "high",
    "dedupe_key": "backend-F-002",
    "global_id": "2026-09-06-path-echolet-cli-prototype-t28#F-005"
  },
  {
    "id": "F-006",
    "severity": "blocker",
    "file": "apps/relay/internal/validation/validate.go",
    "line": 82,
    "problem": "V1 request bodies are unbounded and send-envelope limits trust attacker-supplied size_bytes.",
    "impact": "The configured message-byte limit is bypassed, accepted oversized records make a mailbox unreadable through the CLI, and parsing permits memory exhaustion. No signature or victim key is needed for the send path.",